id,question_id,answer,level
MS.14b.382.1,MS.14b,That they ball in the cup and the mass pieces are in this cup. 20 grams plus 10 grams equals 30.,incorrect
MS.14b.391.1,MS.14b,I chose it because there is a 20 grams piece and a 10 grams piece but the ball is not even with the other side so it must weigh more.,correct
MS.14b.396.1,MS.14b,Because the mass pieces gives you the answer.,incorrect
MS.14b.398.1,MS.14b,I chose it because the mass pieces are 30 grams. So I did the highest number.,correct
MS.14b.400.1,MS.14b,Because it is very simple I added 20 plus 10 and it equaled 30 grams. And that is how I got my answer.,incorrect
MS.14b.417.1,MS.14b,Because in the cup there are 30 grams. So I picked 40 because 30 grams is not enough so I put 40 grams.,correct
MS.14b.426.1,MS.14b,Because I carried a ball before and it felt like to me it is 30 grams.,incorrect
MS.14b.452.1,MS.14b,I put answer b because 20 plus 10 equals 30.,incorrect
MS.14b.463.1,MS.14b,Because if you see it is that because I chose it.,incorrect
MS.14b.488.1,MS.14b,Because 20 grams plus 10 grams equals 30 grams.,incorrect
MS.14b.501.1,MS.14b,"Because a ball is heavy, and if you put in 10 grams it will probably weight.",correct
MS.14b.532.1,MS.14b,20 plus 10 equals 30 and that is smaller than the ball which must be C.,correct
MS.14b.566.1,MS.14b,Because 20 grams plus 10 grams equals 30 grams.,incorrect
MS.14b.569.1,MS.14b,Because the ball cannot be 40 grams or 20 grams it has to be 30 grams because the ball it little.,incorrect
MS.14b.592.1,MS.14b,Because there is no standard unit.,incorrect
MS.14b.594.1,MS.14b,Because 30 grams and 20 grams is much big.,incorrect
MS.14b.595.1,MS.14b,20 grams plus 10 grams equals 30 grams.,incorrect
MS.14b.599.1,MS.14b,Because 20 grams and 10 grams is 30 grams.,incorrect
MS.30b.101.1,MS.30b,The rug was 12.,incorrect
MS.30b.108.1,MS.30b,They can measure the rug with a meter tape.,correct
MS.30b.112.1,MS.30b,Use a meter tape.,correct
MS.30b.115.1,MS.30b,Use a meter tape.,correct
MS.30b.136.1,MS.30b,They could use a measuring tape and that is how they will get the same answer.,correct
MS.30b.137.1,MS.30b,Next time they can use a measuring tape to be more accurate.,correct
MS.30b.144.1,MS.30b,They could use a meter tape.,correct
MS.30b.146.1,MS.30b,They should use a standard measurement.,correct
MS.30b.152.1,MS.30b,The size of the rug was 18 grams.,incorrect
MS.30b.171.1,MS.30b,They could use a meter tape.,correct
MS.30b.174.1,MS.30b,Have Mary come over and measure her room too.,incorrect
MS.30b.190.1,MS.30b,"They could use a meter tape, a centimeter ruler, or a inch ruler.",correct
MS.30b.276.1,MS.30b,They should use a standard metric unit to measure the rug like a meter tape.,correct
MS.30b.282.1,MS.30b,Use a ruler.,correct
MS.30b.288.1,MS.30b,She can measure with a centimeters.,correct
MS.30b.294.1,MS.30b,They could use a standard unit to measure the rug.,correct
MS.30b.312.1,MS.30b,They could use a standard measurement.,correct
MS.30b.316.1,MS.30b,They should return it and get another rug and measure with a meter tape.,correct
MS.30b.319.1,MS.30b,Use a standard measurement like a meter.,correct
MS.30b.324.1,MS.30b,They can use a metric tape.,correct
MS.30b.348.1,MS.30b,They have to get a measure tape.,correct
MS.30b.359.1,MS.30b,They could use a meter stick.,correct
MS.30b.391.1,MS.30b,They could have used a meter tape.,correct
MS.30b.396.1,MS.30b,They could buy a new rug and see if it fits.,incorrect
MS.30b.400.1,MS.30b,They could get a meter tape and see how long it is.,correct
MS.30b.417.1,MS.30b,By using a measuring tape.,correct
MS.30b.426.1,MS.30b,She could use measuring tape and see how much is it.,correct
MS.30b.452.1,MS.30b,Sharice could have the rug and her wall before buying the rug.,incorrect
MS.30b.463.1,MS.30b,Use a meter.,correct
MS.30b.486.1,MS.30b,Take the rug and if it fits buy it.,incorrect
MS.30b.488.1,MS.30b,With a centimeters tape.,correct
MS.30b.496.1,MS.30b,To use a centimeters tape.,correct
MS.30b.501.1,MS.30b,Cut it.,incorrect
MS.30b.532.1,MS.30b,They should use a standard unit of measure like a meter stick.,correct
MS.30b.569.1,MS.30b,They could use a ruler to measure the rug better then they got the right answer.,correct
MS.30b.571.1,MS.30b,They can use meters or a tape measure.,correct
MX.1.384.1,MX.1,Because the salt was too small so small that you cannot see it.,correct
MX.1.426.1,MX.1,Because sand is much softer and the salt.,incorrect
MX.1.428.1,MX.1,Because the salt dissolved into the water and the sand did not.,incorrect
MX.1.430.1,MX.1,Because salt and water are a solution but sand and water is just a mixture.,incorrect
MX.1.431.1,MX.1,The sand got caught because it had rocks in it.,incorrect
MX.1.457.1,MX.1,The salt went through because when the salt and water mixed the salt dissolved a little.,incorrect
MX.1.464.1,MX.1,The particle size of the sand was too big to fit through the holes of the filter. While the salt particle size was too small to get caught.,correct
MX.1.470.1,MX.1,The salt did not get caught because it dissolved in the water.,incorrect
MX.1.472.1,MX.1,The salt went through the filter because it dissolved and the sand did not.,incorrect
MX.1.486.1,MX.1,Because he put water in it so the salt dissolved with the water and ran right through.,incorrect
MX.1.488.1,MX.1,Because salt is so small it slid through the large coffee filter. Sand is larger so it stuck to the filter.,correct
MX.1.494.1,MX.1,The salt turns to liquid like an ice cube and then to water sand does not.,incorrect
MX.1.495.1,MX.1,The sand was too big to fit through the tiny holes in the filter. The salt dissolved into the water and was way too small to get caught in the filter. It just went through.,incorrect
MX.1.498.1,MX.1,The salt went through the filter because the salt mix with water to make saltwater. Sand the sand got caught because it is just like the powder it sticks to the sides.,incorrect
MX.1.500.1,MX.1,The salt is smaller and is harder.,correct
MX.1.528.1,MX.1,The salt had gone away or dissolved.,incorrect
MX.1.533.1,MX.1,Because the sand is bigger than the salt.,correct
MX.1.539.1,MX.1,The grains of salt must be smaller than the grains of sand.,correct
MX.1.562.1,MX.1,The salt got dissolved in the water.,incorrect
MX.1.564.1,MX.1,Because the sand is thicker than the water. Water is smooth.,incorrect
MX.1.565.1,MX.1,Because the filter has smaller holes so whatever big particle will be separated.,correct
MX.1.567.1,MX.1,Maybe because in the little dish there is little holes and it will not go through it.,correct
MX.1.569.1,MX.1,The salt was small enough to go through the holes while the sand was too big to go through.,correct
MX.1.599.1,MX.1,The sand cannot go through because the water would not let the sand dissolve.,incorrect
MX.1.601.1,MX.1,It stayed there because of its size.,incorrect
MX.1.604.1,MX.1,Because the salt evaporated so it could go through and still have salt in it. While sand did not so it could not go through.,correct
MX.1.606.1,MX.1,Because salt can dissolve but sand is tiny parts of the ground.,incorrect
MX.1.607.1,MX.1,Because the salt dissolved in the water and the sand did not.,incorrect
MX.1.613.1,MX.1,Because the salt is evaporated already and the sand cannot because it is hard and it is gravel.,incorrect
MX.1.633.1,MX.1,The salt became a part of the water so it dissolve in the water so the salt went with the water. But the sand did not dissolve in the water because it was so bulky.,incorrect
MX.1.642.1,MX.1,The salt dissolved and became smaller. The sand became mud and got caught together and stayed on top.,incorrect
MX.1.649.1,MX.1,They have a sticky stuff that did not work.,incorrect
MX.22a.385.1,MX.22a,You can see through it.,incorrect
MX.22a.386.1,MX.22a,"It is one material that dissolves into the other. Making a clear mixture. Although it could be colored, it has to be see through.",correct
MX.22a.390.1,MX.22a,It is a clear mixture.,incorrect
MX.22a.391.1,MX.22a,It dissolves the solid into a liquid that is see through.,correct
MX.22a.396.1,MX.22a,It has to be a fairly clear.,incorrect
MX.22a.397.1,MX.22a,A solution is a solid and a liquid mixed together.,incorrect
MX.22a.400.1,MX.22a,In a solution one of the materials dissolves and the mixture is see through.,correct
MX.22a.416.1,MX.22a,A solution is different because a solution is a mixture of a solid material and a liquid.,incorrect
MX.22a.419.1,MX.22a,Because 2 mixtures become a solution. A solution is different because mixture cannot become a solution only 2 can.,incorrect
MX.22a.421.1,MX.22a,The difference from other mixtures was that we only used 2 and other people might use 3 or 4.,incorrect
MX.22a.422.1,MX.22a,"A solution is when you take a mixture like powder and mix it with water then after stirring it, it becomes a solution.",correct
MX.22a.426.1,MX.22a,"Because it is made of 2 mixtures, and making it one mixture and becoming a solution of 2 mixtures.",incorrect
MX.22a.463.1,MX.22a,A solution is 2 materials put together and the one dissolves. And on a mixture they stay so you can see it.,incorrect
MX.22a.466.1,MX.22a,It is different because in other mixtures the liquid dissolves but in a solution the solid material dissolves.,correct
MX.22a.472.1,MX.22a,A solution is different from a mixture because it is when you mix 2 or more things and a solution is when like water and salt dissolves or evaporated.,incorrect
MX.22a.473.1,MX.22a,When you make solution tiny particles of the solid explained some cannot see it.,incorrect
MX.22a.495.1,MX.22a,The solid material dissolves.,incorrect
MX.22a.499.1,MX.22a,A solution is a different type of mixture. Then they are a solution is a mixtures that dissolves.,incorrect
MX.22a.502.1,MX.22a,The salt dissolved in the mixture.,incorrect
MX.22a.521.1,MX.22a,A solution something that dissolves.,correct
MX.22a.527.1,MX.22a,A solution is something that dissolves into the liquid and a mixture is something mixed up together.,correct
MX.22a.528.1,MX.22a,When the mixture is mixed.,incorrect
MX.22a.530.1,MX.22a,A solution does not dissolve.,incorrect
MX.22a.542.1,MX.22a,Other mixtures are mixed with peas and tomatoes and other foods.,incorrect
MX.22a.559.1,MX.22a,A solution is when an object disappears in the liquid and in a mixture the object does not disappear.,correct
MX.22a.562.1,MX.22a,A solution is something put into a liquid and made one thing.,incorrect
MX.22a.577.1,MX.22a,In a solution one material dissolves into the liquid.,correct
MX.22a.595.1,MX.22a,Solutions are clear.,incorrect
MX.22a.600.1,MX.22a,Clear and 2 things that make it still clear.,incorrect
MX.22a.601.1,MX.22a,A solution is different because it is clear that you can see through.,incorrect
MX.22a.604.1,MX.22a,A solution is separated but a mixture is a bunched up together.,incorrect
MX.22a.611.1,MX.22a,Because a solution is clear but other mixtures are not.,incorrect
MX.22a.633.1,MX.22a,It has and weighs more with more things in it than a solution.,incorrect
MX.22a.638.1,MX.22a,Because one of the chemicals dissolves.,incorrect
MX.22a.641.1,MX.22a,The solid must dissolve.,correct
MX.22a.649.1,MX.22a,They have a different type of them that they have different ideas.,incorrect
MX.24.384.1,MX.24,Because it turns clear. It bubbles.,incorrect
MX.24.388.1,MX.24,When you can see through the solution. When the solid gets dissolved into the liquid.,correct
MX.24.389.1,MX.24,When you mix a solid and a liquid it is clear.,incorrect
MX.24.390.1,MX.24,Because the mixture is clear.,incorrect
MX.24.393.1,MX.24,It is clear and can be separated with evaporation.,incorrect
MX.24.394.1,MX.24,"You can see through the mixture, and one material has dissolved.",correct
MX.24.400.1,MX.24,"When one seems to disappear because it has dissolved, and you can see through it.",correct
MX.24.433.1,MX.24,When it creates one type of something. Like chocolate milk.,incorrect
MX.24.435.1,MX.24,It is when you cannot see the solid from the liquid.,correct
MX.24.438.1,MX.24,When you cannot separate them with filters or screens.,incorrect
MX.24.455.1,MX.24,"The solid seems to disappear, or dissolve.",incorrect
MX.24.465.1,MX.24,Well I will see the solid at the bottom and the liquid on top of it.,incorrect
MX.24.466.1,MX.24,You know because the solid matrix I will dissolve overnight.,incorrect
MX.24.467.1,MX.24,Then material will probably split up into smaller parts.,incorrect
MX.24.469.1,MX.24,Because the solid is kind of hard and liquid is more smoother.,incorrect
MX.24.470.1,MX.24,When you cannot see the solid.,incorrect
MX.24.495.1,MX.24,The solid dissolves. The solid breaks into tiny pieces so tiny no one can see it.,correct
MX.24.497.1,MX.24,If you experiment you might find a way to separate.,incorrect
MX.24.499.1,MX.24,Of the materials dissolve.,incorrect
MX.24.563.1,MX.24,You know when the solid is dissolved.,incorrect
MX.24.573.1,MX.24,When water and salt mix the salt disappears or seems to and when you cannot see the salt that means you have made a solution.,correct
MX.24.576.1,MX.24,The solid disappears into air pockets.,correct
MX.24.593.1,MX.24,When something is mixing so you get a solution.,incorrect
MX.24.598.1,MX.24,You see how it mixes together and sometimes there are bubbles or wet.,incorrect
MX.24.600.1,MX.24,It is clear.,incorrect
MX.24.601.1,MX.24,I know that because it is mixed up because it is not clear anymore.,incorrect
MX.24.608.1,MX.24,When the water turns gray or a different color.,incorrect
MX.24.610.1,MX.24,"Powder and water when they mix together. The water turn white, that how you tell or you look to the bottom.",incorrect
MX.24.613.1,MX.24,When they are in the container the water brushes off some dirt from the solid.,incorrect
MX.24.629.1,MX.24,When the solid dissolves.,incorrect
MX.24.638.1,MX.24,Because one of the chemicals dissolves.,incorrect
MX.52b.385.1,MX.52b,Because it look a lot like alum.,incorrect
MX.52b.389.1,MX.52b,I chose it because I looked at the key below and I saw the same shape.,incorrect
MX.52b.391.1,MX.52b,Because they are the same shape.,incorrect
MX.52b.396.1,MX.52b,"Because the particles in her dish, look like the ones in the box down below labeled alum.",correct
MX.52b.400.1,MX.52b,Because on the key alum is a hexagon and a hexagon in the middle with lines going from each point to the point on the hexagon inside.,correct
MX.52b.416.1,MX.52b,I chose alum because it looks like alum and the mystery solution have the same pattern.,incorrect
MX.52b.431.1,MX.52b,Because you see the picture in the dish and it looks the same.,incorrect
MX.52b.456.1,MX.52b,I looked at the crystal shape key and it looks most like alum.,correct
MX.52b.460.1,MX.52b,Because they look the same.,incorrect
MX.52b.465.1,MX.52b,Well I look at the key below and I saw the same way it looked at the top.,incorrect
MX.52b.468.1,MX.52b,Because that is what it is call and we talks about that is what it is call.,incorrect
MX.52b.471.1,MX.52b,Because I thought it was the best answer.,incorrect
MX.52b.473.1,MX.52b,I looked at the pictures below and one of them looked like mystery solution looked at it said alum I picked alum.,correct
MX.52b.486.1,MX.52b,Because crystals look like a small amount and have lines on the side something each crystal has its own shape.,incorrect
MX.52b.490.1,MX.52b,I looked at the pictures and words and I tried to see which one matched the crystals in the circle.,incorrect
MX.52b.493.1,MX.52b,Because picture tips of crystal like the same.,incorrect
MX.52b.503.1,MX.52b,Because that is the picture Emily drew. Crystals have different shapes.,incorrect
MX.52b.528.1,MX.52b,You can see it on the pictures.,incorrect
MX.52b.533.1,MX.52b,Just a wild guess.,incorrect
MX.52b.539.1,MX.52b,Because it showed what alum looks like at the bottom.,incorrect
MX.52b.556.1,MX.52b,Because they look the same.,incorrect
MX.52b.557.1,MX.52b,Because they look like they have the same properties.,incorrect
MX.52b.559.1,MX.52b,"I chose that answer, because the picture look the same.",incorrect
MX.52b.565.1,MX.52b,Because picture show the exact same thing as alum in the picture below.,correct
MX.52b.595.1,MX.52b,Because they look the same.,incorrect
MX.52b.600.1,MX.52b,The alum has the same pattern and it looks the same.,incorrect
MX.52b.601.1,MX.52b,I chose that answer because it looks the same like the drawing in the circle.,incorrect
MX.52b.606.1,MX.52b,Because it shows the pictures below.,incorrect
MX.52b.611.1,MX.52b,I chose that answer because when I look down the picture it look the same as the picture up there.,incorrect
MX.52b.612.1,MX.52b,Because the picture down below of Epsom salt has no lines or anything.,incorrect
MX.52b.626.1,MX.52b,Because her drawing looks the same as the one in the shape key.,incorrect
MX.52b.633.1,MX.52b,The alum in the picture below is a tall hexagon the crystal in the picture above is also a tall hexagon so it led me to the conclusion that they are the same.,correct
MX.52b.638.1,MX.52b,Because alum looks like the picture above.,correct
MX.52b.639.1,MX.52b,Because it looks like alum but more crystals.,correct
MX.52b.643.1,MX.52b,I chose it because on the key it looks the same as the crystal evaporating dish.,incorrect
MX.52b.648.1,MX.52b,It looks closer than the other.,incorrect
MX.42a.101.1,MX.42a,The solid was too big to go through the filter paper.,correct
MX.42a.106.1,MX.42a,Because the little piece of the liquid and the undissolved is bigger.,correct
MX.42a.126.1,MX.42a,It is separate because the paper filter is liquid.,incorrect
MX.42a.172.1,MX.42a,Because the solid is too heavy to go through the paper.,incorrect
MX.42a.291.1,MX.42a,Solid is too big to go through the filter hole. Liquid is just water that can go through almost anything.,correct
MX.42a.389.1,MX.42a,Because the filter cannot hold the water because the filter already has water in it.,incorrect
MX.42a.394.1,MX.42a,"The holes in the filter are smaller than the solid particles, and the water particles are smaller than the holes, so the water goes through the filter while the solid will not go through.",correct
MX.42a.397.1,MX.42a,Because the particle size was too big and the filter could not hold any more water because it was wet.,incorrect
MX.42a.423.1,MX.42a,"Because when the solid touches the side, it sticks.",incorrect
MX.42a.432.1,MX.42a,Because the solid was bigger than the liquid so it got stuck!,correct
MX.42a.448.1,MX.42a,Because she did not wet the filter and when she put the water they got wet.,incorrect
MX.42a.452.1,MX.42a,Because the materials are too big to go through the holes but the water is not too big to go through the holes in the filter.,correct
MX.42a.453.1,MX.42a,It stays in the filter because the solid material does not count as the solution.,incorrect
MX.42a.454.1,MX.42a,The solid does not go through the filter like the liquid because the liquid is small enough to go through the filter but the solid is too large.,correct
MX.42a.458.1,MX.42a,Because it is a thick.,incorrect
MX.42a.462.1,MX.42a,Because the holes in the filter are too small for the solid to go through them.,correct
MX.42a.466.1,MX.42a,The solid stayed in because it was too big to go through the microscopic holes in the filter paper.,correct
MX.42a.470.1,MX.42a,The solid stays in the filter because the particles are too big to go through but dissolved can go through because the particles are small enough.,correct
MX.42a.472.1,MX.42a,It stays at the top because it is too big to go through the filter and the water is just a liquid.,correct
MX.42a.473.1,MX.42a,The solid is hard. It cannot go through because it is not a liquid.,incorrect
MX.42a.490.1,MX.42a,Because the solute in the saturated solution dissolved and were dispersed equally. The material that did not go through was too big to go through.,correct
MX.42a.497.1,MX.42a,Because the materials are stuck together with water and cannot go through the tiny holes in the filter.,incorrect
MX.42a.502.1,MX.42a,Because when the water goes through the filter some water stays which helps the filter catch the sugar.,incorrect
MX.42a.524.1,MX.42a,Because it is too thick to slide down the filter.,correct
MX.42a.532.1,MX.42a,Because the solid stay because it is too big and water it can just go through things like that.,correct
MX.42a.540.1,MX.42a,Because they are big.,incorrect
MX.42a.543.1,MX.42a,The solid stayed in because it was not as watery and it was bigger chucks. The liquid is watery and so it went through.,incorrect
MX.42a.559.1,MX.42a,The solid stays in the filter because the filter's holes are too small for the liquid to go through.,incorrect
MX.42a.562.1,MX.42a,Because paper absorbent and solids cannot go through solids.,incorrect
MX.42a.563.1,MX.42a,The liquid was too big to go through the holes.,incorrect
MX.42a.567.1,MX.42a,Because in the filter paper there are little holes!,correct
MX.42a.568.1,MX.42a,The solid would be too big to pass through the small holes in the filter paper.,correct
MX.42a.575.1,MX.42a,The solid stays because its particle size was too large to go through the filter.,correct
MX.42a.596.1,MX.42a,Because water goes through the paper and the salt is not water.,incorrect
MX.42a.604.1,MX.42a,Because the liquid is a substance that can go through most objects with small or tiny holes and solid cannot.,incorrect
MX.42a.607.1,MX.42a,Because the solid did not dissolve.,incorrect
MX.16a.140.1,MX.16a,No because one has more water.,incorrect
MX.16a.206.1,MX.16a,"No, because they do not say how much spoons are in there and 250 milliliters is more concentrated.",incorrect
MX.16a.243.1,MX.16a,No. Because one has more water.,incorrect
MX.16a.277.1,MX.16a,No because it has to be equal.,incorrect
MX.16a.291.1,MX.16a,"No, because one has more water.",incorrect
MX.16a.366.1,MX.16a,No they do not because they are not the same amount of water and it will not equal the same.,incorrect
MX.16a.381.1,MX.16a,"Yes, because if you get the same amount of water from each then weighed it they would measure up to the same amount.",incorrect
MX.16a.386.1,MX.16a,"No, because there is less room for the solute to spread out in Mariella's solution. The material at the bottom is not part of the solution.",incorrect
MX.16a.389.1,MX.16a,Yes because they both have the same amount of solid.,incorrect
MX.16a.390.1,MX.16a,No because they have the same solid but different amounts of water.,incorrect
MX.16a.394.1,MX.16a,"Yes, the solutions have the same concentration because, using the same solute and water, there is a saturation point per milliliters of water and they have both reached the saturation point, they are saturated and cannot become any more concentrated, so they are both equally concentrated.",correct
MX.16a.416.1,MX.16a,"No, they do not because Richard put more water which will make it less concentrated.",incorrect
MX.16a.437.1,MX.16a,No. I think that Mariella's saturated solution is more concentrated because it has more solid.,incorrect
MX.16a.453.1,MX.16a,No because one has more water which will make the solution heavier than the other.,incorrect
MX.16a.463.1,MX.16a,"Yes because if they are saturated, then the stuff on bottom went to waste and the waters are holding the same number of water and solid except for the stuff on the bottom. Take that stuff out then they both have the same concentration.",correct
MX.16a.464.1,MX.16a,"No, because the 100 milliliters of water is more concentrated because it has less solvent and 250 milliliters of water has more solvent.",incorrect
MX.16a.466.1,MX.16a,"No because if you had Kool-aid the one with more water will give the powder more space to dissolve, but the one with less water will saturate because there is less space for the powder to dissolve.",incorrect
MX.16a.488.1,MX.16a,Yes because they both cannot hold any more solid.,correct
MX.16a.494.1,MX.16a,Yes. They are both saturated which means they are also concentrated.,incorrect
MX.16a.528.1,MX.16a,No. Why because one has 3 spoons of salt in it and 2 has 4 spoons of salt in it that is why it is more solution.,incorrect
MX.16a.557.1,MX.16a,"No, because it might be a different amount of the solid in it.",incorrect
MX.16a.564.1,MX.16a,I think yes because it does not matter how much whatever you put in it and they put the same amount of stuff.,incorrect
MX.16a.566.1,MX.16a,"Yes, because if you take out the same amount of water out of each solution and put them on a balance then they will weigh the same. Only a certain amount of water can hold a certain amount of salt.",incorrect
MX.16a.572.1,MX.16a,No it does not because the 250 is more than 100.,incorrect
MX.16a.573.1,MX.16a,Yes because if you take out a certain amount of water out of each of them and weigh them and they will weigh the same.,incorrect
MX.16a.576.1,MX.16a,"No, the one with 100 milliliters of water is more concentrated because the solid has less room.",incorrect
MX.16a.584.1,MX.16a,No because Richard has more water than Mariella and Mariella only has 100 milliliters of water. And it is more crowded with 100 milliliters of water.,incorrect
MX.16a.592.1,MX.16a,"No, because Richard has more concentration space than Mariella because he has more water which means less saturation room.",incorrect
MX.16a.597.1,MX.16a,"Yes, because they are both saturated and if they add more it will just become more saturated.",incorrect
MX.16a.598.1,MX.16a,Yes. Because they both put sort of the same amount of water into the cup and so they both have the same concentration.,incorrect
MX.16a.601.1,MX.16a,"No, because Mariella's solution had more water.",incorrect
MX.16a.606.1,MX.16a,Yes there is the same amount of solution.,incorrect
MX.16a.611.1,MX.16a,"No, because if they did then both the water would be the same.",incorrect
