id,question_id,answer,level
LF.33b.260.1,LF.33b,The clay is in the river because the clay mixes in with the water.,incorrect
LF.33b.284.1,LF.33b,It is heavy so I thought it would drop off quick.,incorrect
LF.33b.285.1,LF.33b,It is deposited the farthest because it is lighter than the other ones.,correct
LF.33b.291.1,LF.33b,Because sand is heavier and since the sand is heavier it would go down from clay and there is a bigger amount of sand too.,incorrect
LF.33b.662.1,LF.33b,Clay is where I indicated it because clay is the lightest material so it travels the farthest.,correct
LF.33b.664.1,LF.33b,It was deposited because it begins to settle to the bottom because the channel is slowing its current.,incorrect
LF.33b.665.1,LF.33b,The clay is deposited where I indicated because the river has brought the clay in the lake.,incorrect
LF.33b.668.1,LF.33b,"It is deposited because the water, river is taking it away with it.",incorrect
LF.33b.680.1,LF.33b,The clay goes the farthest because it has the least particles.,correct
LF.33b.682.1,LF.33b,The clay is deposited where I indicated it because it is heaviest so it will not go as far.,incorrect
LF.33b.685.1,LF.33b,The clay is lighter so it is carried farther.,correct
LF.33b.689.1,LF.33b,The clay is there because it has lighter and smaller particles which makes it float to the top.,correct
LF.33b.699.1,LF.33b,Because clay is the lightest.,incorrect
LF.33b.701.1,LF.33b,The clay is deposited there because the clay is the lightest and everything else is heavier so it sinks.,correct
LF.33b.707.1,LF.33b,It is deposited there because it is lighter than sand and pebbles.,correct
LF.33b.738.1,LF.33b,Very near to the mouth of the river.,incorrect
LF.33b.784.1,LF.33b,The clay is very light so it can be carried farther than the sand and pebbles.,correct
LF.33b.802.1,LF.33b,"The clay is deposited there, because the clay has the least amount of mass so it will go farther.",correct
LF.33b.814.1,LF.33b,The clay is deposited where I indicated because the clay has the lesser mass so it is can be carried the farthest.,incorrect
LF.33b.825.1,LF.33b,It was deposited there because it has a lesser mass and therefore is carried farther than all of the other earth materials.,correct
LF.33b.837.1,LF.33b,The clay is where I indicated it because it is the one that gets pushed out the farthest.,incorrect
LF.33b.844.1,LF.33b,Clay is lighter than sand or pebbles so it would be easier for water to carry it farther.,correct
LF.33b.922.1,LF.33b,The clay is deposited where I indicated because it is the lightest.,correct
LF.33b.937.1,LF.33b,The clay deposit is farther because of its light weight.,incorrect
LF.33b.940.1,LF.33b,The clay is indicated where I put it because clay is soft and lines are soft too.,incorrect
LF.34b.103.1,LF.34b,The river dries as it gets to the mountains.,incorrect
LF.34b.108.1,LF.34b,It flows that way because you cannot make a river flow uphill.,incorrect
LF.34b.109.1,LF.34b,Because it starts between a valley and mountains and goes the opposite direction.,incorrect
LF.34b.137.1,LF.34b,Because it flows down from the mountains.,incorrect
LF.34b.177.1,LF.34b,I think the water flows that way because it is going from happy valley to the river.,incorrect
LF.34b.212.1,LF.34b,Why is that the water flows down away from the mountain.,correct
LF.34b.213.1,LF.34b,Because it is big at beginning then slowly gets smaller and branches out.,incorrect
LF.34b.216.1,LF.34b,Because it goes happy valley then the river.,incorrect
LF.34b.223.1,LF.34b,Because it does not go into the mountain.,incorrect
LF.34b.225.1,LF.34b,The river flows from biggest to smallest. That is why.,incorrect
LF.34b.253.1,LF.34b,Because rivers sometimes end in valleys.,incorrect
LF.34b.262.1,LF.34b,The delta.,incorrect
LF.34b.357.1,LF.34b,Because the water flow to the basin which is the rose mountains.,incorrect
LF.34b.667.1,LF.34b,It flows in that direction because the water is going high land to low land.,correct
LF.34b.668.1,LF.34b,"Maybe because the mountains are that way, or there are cracks and the water goes through.",incorrect
LF.34b.670.1,LF.34b,Because the mountain is the highest peak and water flows downhill.,correct
LF.34b.673.1,LF.34b,I think that because the water flows down from the mountain first.,correct
LF.34b.684.1,LF.34b,Because there are little slots that take them that way.,incorrect
LF.34b.707.1,LF.34b,I think it flows that way because rivers usually flow from valleys into mountains.,incorrect
LF.34b.734.1,LF.34b,I think the water flows in that direction because the river is still trying to find the easiest route.,incorrect
LF.34b.753.1,LF.34b,Because the earth's gravitational pull.,incorrect
LF.34b.768.1,LF.34b,Because the river leads to an open delta.,incorrect
LF.34b.769.1,LF.34b,It flows in that direction because the mountain usually carries the water down the side of the mountain.,incorrect
LF.34b.776.1,LF.34b,I think the water flows in that direction because water cannot flow uphill.,incorrect
LF.34b.779.1,LF.34b,Rivers usually flow through valley. It grow weaker at the mountain because it cannot go uphill.,incorrect
LF.34b.787.1,LF.34b,There are other little streams at that end that was formed by water.,incorrect
LF.34b.788.1,LF.34b,Rivers cannot flow up mountain and valleys cannot be on mountain so it is flowing towards happy valley.,correct
LF.34b.802.1,LF.34b,"I think that way, because the water will flow down the mountain, not up it.",incorrect
LF.34b.807.1,LF.34b,All the streams flow together forming one bigger river.,incorrect
LF.34b.810.1,LF.34b,I think this because the stream is getting wider as it goes on.,incorrect
LF.34b.811.1,LF.34b,Because that is downhill.,incorrect
LF.34b.817.1,LF.34b,I think it flows there because the river eroded the valley and the water would be flowing down the valley.,incorrect
LF.34b.819.1,LF.34b,The river gets the water from the mountain and takes it to happy valley.,incorrect
LF.34b.827.1,LF.34b,I think the water flows in the direction because that is where the crack is.,incorrect
LF.34b.840.1,LF.34b,I think flows in that direction because it starts small and it gets bigger.,incorrect
LF.34b.844.1,LF.34b,I think the water flows in that direction because water cannot flow up a mountain.,incorrect
LF.18a.101.1,LF.18a,It depends on if it has a slope or no slope.,incorrect
LF.18a.114.1,LF.18a,A flood will make the creek overflow faster and will make more damage.,correct
LF.18a.120.1,LF.18a,It flows faster and carries lots of birdie.,incorrect
LF.18a.122.1,LF.18a,With normal water flow there is not as much water than a flood.,incorrect
LF.18a.148.1,LF.18a,The flood water rises and goes really fast picking up sand and dirt.,correct
LF.18a.184.1,LF.18a,Water flows with a lot more force normal water goes a lot less fast.,incorrect
LF.18a.189.1,LF.18a,They both create erosion.,incorrect
LF.18a.221.1,LF.18a,"During a flood the creek's volume will increase greatly, the water will run faster, and there will be mudslides, compared to normal water flow, which is constant and steady, and erodes less.",correct
LF.18a.223.1,LF.18a,"It will flow fast and crazy, but with a normal one it floods slow and calm.",incorrect
LF.18a.248.1,LF.18a,The water flow in a creek during a flood is different from normal water flow because the water during a flood would flow more rapidly than the normal flow.,incorrect
LF.18a.256.1,LF.18a,The difference between a flooded creek and a normal creek is water level and water pressure.,correct
LF.18a.258.1,LF.18a,"During a flood, the water flow is faster and heavier.",incorrect
LF.18a.265.1,LF.18a,The water goes faster and the water gets higher and it start to overflow.,correct
LF.18a.281.1,LF.18a,The water flows quickly during floods and also the water is high and normal water flows pretty calm and is not usually as high as water is during floods.,correct
LF.18a.282.1,LF.18a,The water in a chart is much higher during a flood and it goes faster.,correct
LF.18a.284.1,LF.18a,The water rises and starts getting wavy and out of hand.,correct
LF.18a.285.1,LF.18a,In a flood it would spread farther.,incorrect
LF.18a.288.1,LF.18a,In a flood the water flows faster than in normal water level.,correct
LF.18a.289.1,LF.18a,A creek usually flows slowly and floods usually flow quickly.,incorrect
LF.18a.295.1,LF.18a,It flows faster because of the water current pushing the other one.,incorrect
LF.18a.350.1,LF.18a,It will flow faster and might swerve off track.,incorrect
LF.18a.352.1,LF.18a,The writer in the flood goes faster and more water comes out at once.,correct
LF.18a.673.1,LF.18a,The water in the creek during a flood is more capped than a normal molten. During a flood the water runs through more quickly and picks up earth materials in deposition first and takes them further. Also erosion happen more quickly.,incorrect
LF.18a.674.1,LF.18a,The water would flow much faster and rise above the marshes. During a normal day the water would not be moving very fast and if would not be over the marshes.,correct
LF.18a.676.1,LF.18a,When there is a flood the water flow is much faster. It is also stronger.,incorrect
LF.18a.678.1,LF.18a,It flows faster.,incorrect
LF.18a.701.1,LF.18a,The water flows a lot faster during a flood compared to the speed flowing during a normal flow.,incorrect
LF.18a.702.1,LF.18a,It overflows in a creek and a lake on river.,incorrect
LF.18a.779.1,LF.18a,In a flood the water would be moving stronger and faster than usual.,incorrect
LF.18a.801.1,LF.18a,Flood water has a great velocity and force.,incorrect
LF.18a.811.1,LF.18a,The water overlaps the area around the creek during a flood.,incorrect
LF.18a.823.1,LF.18a,The water goes out of its channel. The water speeds up.,correct
LF.18a.825.1,LF.18a,The water in the creek during a flood will flow much harder and faster causing more and more erosion compared to water flow without creek.,incorrect
LF.18a.838.1,LF.18a,It is compared to different speed a flow patterns.,incorrect
LF.18a.848.1,LF.18a,The water flows in a faster range than normal because there is more water.,correct
LF.18a.940.1,LF.18a,The water flow in a creek during a flood compared to normal water flow is the same.,incorrect
LF.28a2.381.1,LF.28a2,The minutes and seconds of when the events happened.,incorrect
LF.28a2.403.1,LF.28a2,What time everything happened.,incorrect
LF.28a2.412.1,LF.28a2,Whether it is slope or not.,incorrect
LF.28a2.416.1,LF.28a2,That how much is the land that moved.,incorrect
LF.28a2.422.1,LF.28a2,The information I got from the stream table but not from the stream tables are when earth materials slump and hole under the water source.,correct
LF.28a2.430.1,LF.28a2,What the who form.,incorrect
LF.28a2.432.1,LF.28a2,More info of the experiment.,incorrect
LF.28a2.472.1,LF.28a2,When the event happens and time between them.,incorrect
LF.28a2.473.1,LF.28a2,On the stream table logs show when each event happened on the map show where each events looks like.,incorrect
LF.28a2.474.1,LF.28a2,You can get information and time of how fast where and how.,incorrect
LF.28a2.522.1,LF.28a2,Clay sand pebbles.,incorrect
LF.28a2.525.1,LF.28a2,What time something happened.,incorrect
LF.28a2.556.1,LF.28a2,"In a log it tells how is the canyons, deltas, erosions are happening at times. And it shows what the important times are there.",correct
LF.28a2.569.1,LF.28a2,On the stream table log I got the times of everything.,incorrect
LF.28a2.595.1,LF.28a2,When important events happened.,incorrect
LF.28a2.596.1,LF.28a2,You get from a stream table log is a log that tells main events in a certain time and not from a stream table map.,incorrect
LF.28a2.600.1,LF.28a2,You get the time in which things happened.,incorrect
LF.28a2.608.1,LF.28a2,You get what time an important event happened.,incorrect
LF.28a2.688.1,LF.28a2,You can see when all the important happened.,incorrect
LF.28a2.743.1,LF.28a2,You get a chart telling you what happened during the time periods.,incorrect
LF.28a2.752.1,LF.28a2,You get to see how long it took.,incorrect
LF.28a2.778.1,LF.28a2,They explain it in words instead of using pictures.,incorrect
LF.28a2.808.1,LF.28a2,The time the erosion and deposition happens.,correct
LF.28a2.826.1,LF.28a2,You can see what time the events occurred.,incorrect
LF.28a2.839.1,LF.28a2,The information I get from the stream table logs that I do not get from the maps is how long it took for it to form.,incorrect
LF.28a2.841.1,LF.28a2,Elapsed time.,incorrect
LF.28a2.845.1,LF.28a2,The information that you get from stream table logs rather from stream table maps is a log showing you the events of how the slope started from beginning to end.,incorrect
LF.28a2.846.1,LF.28a2,What you get from the logs are the times.,incorrect
LF.28a2.855.1,LF.28a2,Stream table logs show time while maps do not.,incorrect
LF.28a2.873.1,LF.28a2,The information you get is that you do not see the hole in the materials sand.,incorrect
LF.28a2.885.1,LF.28a2,"You cannot see in the maps, the time where the things happen.",incorrect
LF.28a2.886.1,LF.28a2,The time it happens.,incorrect
LF.28a2.923.1,LF.28a2,The information that you do get is what happens and what form.,incorrect
LF.28a2.928.1,LF.28a2,The information I did not get from the stream table logs that I did not get from the stream table maps was the events in order of time.,incorrect
LF.28a2.929.1,LF.28a2,The information you get from a stream table log that you do not get on a stream table map are the keys that tells you what is what.,incorrect
LF.28a2.931.1,LF.28a2,Is that the stream table log is much straight and more details.,incorrect
LF.26a2.399.1,LF.26a2,It so it better to hike. A has more lines.,incorrect
LF.26a2.400.1,LF.26a2,It is more descriptive.,incorrect
LF.26a2.404.1,LF.26a2,So you know what part of the mountain is the easiest part to climb and it has more details.,incorrect
LF.26a2.407.1,LF.26a2,Because it has more description.,incorrect
LF.26a2.437.1,LF.26a2,Because it is easier to read! And there is more information on it.,incorrect
LF.26a2.446.1,LF.26a2,Because it tell where you are going.,incorrect
LF.26a2.452.1,LF.26a2,Because a topographic map shows you if a place is going to be steep it also shows you what other roads or rivers to take well in other words it gives you more detail.,incorrect
LF.26a2.453.1,LF.26a2,To see a bird's eye view which is better view than looking from land.,incorrect
LF.26a2.462.1,LF.26a2,Because it has more and more direction to go.,incorrect
LF.26a2.466.1,LF.26a2,Because it need to walk a little be that is why I think she recommend to her.,incorrect
LF.26a2.472.1,LF.26a2,Because it would tell you where it is more steep and the elevation and the other one will not.,correct
LF.26a2.474.1,LF.26a2,So they can see which is steep or not and safe.,incorrect
LF.26a2.478.1,LF.26a2,Because it is a faster distance from the bottom.,incorrect
LF.26a2.487.1,LF.26a2,Because she walled know now the side where and how steep they are and elevation.,incorrect
LF.26a2.516.1,LF.26a2,Because a topographic map shows the steeps places and where is the best or dangerous place to be and the lines tell you where you are going like if you going around in circles.,incorrect
LF.26a2.521.1,LF.26a2,I would think A because it shows the lakes and rivers and more details of it is location. Plus it shows the symbols of what is there.,incorrect
LF.26a2.551.1,LF.26a2,So you would see the steep sides like 5000.,incorrect
LF.26a2.552.1,LF.26a2,Because it gives better directions and trails.,incorrect
LF.26a2.561.1,LF.26a2,It has more details and they show other paths beside just her's.,incorrect
LF.26a2.564.1,LF.26a2,Because both the maps show the shapes of the landforms but a topographic map shows elevation and steepness.,incorrect
LF.26a2.569.1,LF.26a2,"Pam's friend recommend Map A because you could see the elevation, and see where things are.",correct
LF.26a2.573.1,LF.26a2,Pam's friend recommended the topographic map because it shows the elevation of the mountain they are hiking.,incorrect
LF.26a2.579.1,LF.26a2,It shows the contour lines so they will know how steep the trail is. Also they will recognize the shape of the land.,correct
LF.26a2.584.1,LF.26a2,Pam's friend recommended to use a topographic map for the hike because in a topographic map you can see the profile of something which profile is a side view.,incorrect
LF.26a2.585.1,LF.26a2,She would because it has more information.,incorrect
LF.26a2.586.1,LF.26a2,"They recommended it so they could see the steep parts, they are route, elevation, and shape.",correct
LF.26a2.638.1,LF.26a2,Because it shows more directions and ways and it shows more places and more rivers.,incorrect
LF.26a2.643.1,LF.26a2,Because it is like bird's eye view and so if you look top to bottom you will see almost every detail.,incorrect
LF.26a2.647.1,LF.26a2,She recommended it because it informs them how many feet it increases. Also it shows you more locations so they know if they cross someplace they have gone too far.,correct
LF.26a2.665.1,LF.26a2,Pam's friend recommended using the topographic map because you can see which side of the mountain is the steepest. That way you know where the non steep side. Also it snows rivers.,correct
LF.26a2.669.1,LF.26a2,Pam's friend recommend using the topographic map because it has more information.,incorrect
LF.26a2.673.1,LF.26a2,Pam's friend recommend the topographic map so she can tell which side is steeper. It also shows the elevations for the height.,correct
LF.26a2.674.1,LF.26a2,Because she will know the elevation and which side is steeper.,correct
LF.26a2.708.1,LF.26a2,Because it shows where rivers and lakes are. And it shows mountains and elevation.,incorrect
LF.26a2.711.1,LF.26a2,It tells you where things are.,incorrect
LF.26a2.747.1,LF.26a2,To see the different landforms in front of them.,incorrect
LF.26b2.393.1,LF.26b2,As the contour lines get closer the mountain side gets steeper.,incorrect
LF.26b2.403.1,LF.26b2,The lines are close together.,incorrect
LF.26b2.408.1,LF.26b2,You can tell because it is at the top and it is 5000.,incorrect
LF.26b2.416.1,LF.26b2,Because the contour lines are closer than the others.,incorrect
LF.26b2.417.1,LF.26b2,I can tell because the contour lines closer.,incorrect
LF.26b2.421.1,LF.26b2,S because it is closer together.,incorrect
LF.26b2.430.1,LF.26b2,It is steeper because it is below sea level.,incorrect
LF.26b2.433.1,LF.26b2,Because it looks like it is going further down than the others.,incorrect
LF.26b2.436.1,LF.26b2,How do I know it is the steepest because the lines are closer.,correct
LF.26b2.445.1,LF.26b2,I know because Q is at the bottom of the map.,incorrect
LF.26b2.446.1,LF.26b2,Because the line is closer.,incorrect
LF.26b2.464.1,LF.26b2,Because it has a line in it and probably it is a valley or something.,incorrect
LF.26b2.476.1,LF.26b2,Because the contour lines are close to each other.,incorrect
LF.26b2.477.1,LF.26b2,Because you can see that her lines has the top and it is steeper.,incorrect
LF.26b2.479.1,LF.26b2,Because it is in the middle and it is steeper.,incorrect
LF.26b2.486.1,LF.26b2,Q is the steepest part of the map the line is close together.,correct
LF.26b2.492.1,LF.26b2,Because Q is moving like a snake and it is hard to go swirl like this.,incorrect
LF.26b2.511.1,LF.26b2,Q. Because the contour lines are closer together to make it steeper.,correct
LF.26b2.527.1,LF.26b2,Because it curves going up the mountain.,incorrect
LF.26b2.531.1,LF.26b2,Because the contour lines are closer together than the other R and S.,correct
LF.26b2.537.1,LF.26b2,Because the elevation increases and does not decrease.,incorrect
LF.26b2.680.1,LF.26b2,I know because the contour lines are closer together.,incorrect
LF.26b2.708.1,LF.26b2,Because the lines are closer together.,incorrect
LF.26b2.717.1,LF.26b2,The land lines are close.,incorrect
LF.26b2.740.1,LF.26b2,The lines are closer together.,incorrect
LF.26b2.743.1,LF.26b2,Because it is the straightest part.,incorrect
LF.26b2.778.1,LF.26b2,The contour lines are closer together.,correct
LF.26b2.786.1,LF.26b2,I know because the contour lines are closer together.,incorrect
LF.26b2.802.1,LF.26b2,I know it is the steepest part because the contour lines are closer together.,correct
LF.26b2.808.1,LF.26b2,The contour lines are close together.,incorrect
LF.26b2.814.1,LF.26b2,I know it is the steepest part of the trail because the lines are the closest together.,correct
LF.26b2.823.1,LF.26b2,Because the contour lines are closer.,incorrect
LF.26b2.838.1,LF.26b2,Q because the place it is located.,incorrect
LF.26b2.839.1,LF.26b2,Q is on the steepest part of the trail. I know this because the lines are closer together.,correct
LF.26b2.846.1,LF.26b2,The contour lines are close together.,incorrect
LF.26b2.922.1,LF.26b2,I know it is the steepest trail because the lines are close together.,correct
LF.13a.384.1,LF.13a,Earth material get deposited and forms a delta.,correct
LF.13a.394.1,LF.13a,It goes to a different place.,correct
LF.13a.404.1,LF.13a,Earth material gets deposited to another place.,correct
LF.13a.418.1,LF.13a,They go to a different place.,incorrect
LF.13a.419.1,LF.13a,The materials like burst away.,incorrect
LF.13a.435.1,LF.13a,The earth materials that were weathered away by the erosion flow farther in water or just move away from where they were.,incorrect
LF.13a.441.1,LF.13a,During deposition earth materials are moved to different places.,incorrect
LF.13a.444.1,LF.13a,The eroded earth materials during deposition get deposited to a different area.,correct
LF.13a.452.1,LF.13a,The earth material gets worn away.,incorrect
LF.13a.469.1,LF.13a,The earth explains the and it will but it will explode.,incorrect
LF.13a.477.1,LF.13a,What happens to it is that the deposition goes more far away from the stream table.,incorrect
LF.13a.478.1,LF.13a,The earth material will break into little pieces.,incorrect
LF.13a.504.1,LF.13a,"First, erosion wears all the materials away. Then, deposition makes a v shaped valley.",incorrect
LF.13a.515.1,LF.13a,They go to the mouth of river and deposits there.,correct
LF.13a.516.1,LF.13a,"The socks, sand, and clay start to make a bigger canyon.",incorrect
LF.13a.661.1,LF.13a,The earth materials are carried away and dropped off at the end.,incorrect
LF.13a.672.1,LF.13a,The earth materials get carried away during deposition.,incorrect
LF.13a.678.1,LF.13a,Earth materials get carried away.,incorrect
LF.13a.681.1,LF.13a,During deposition earth materials would get carried away to a new location.,correct
LF.13a.682.1,LF.13a,Earth materials are washed away and settled to the bottom.,correct
LF.13a.688.1,LF.13a,Earth materials are washed downstream and then start to build up land.,correct
LF.13a.705.1,LF.13a,Deposition is when earth materials move from one.,correct
LF.13a.717.1,LF.13a,They are dark in new places.,incorrect
LF.13a.732.1,LF.13a,The earth materials that have been eroded is deposited at the mouth of a river or stream forming a delta.,incorrect
LF.13a.744.1,LF.13a,It is placed and left in deltas and riverbanks.,incorrect
LF.13a.754.1,LF.13a,After deposition earth material is carried out to river banks. Deltas form and into the ocean.,correct
LF.13a.770.1,LF.13a,The earth materials were broken down and separated.,incorrect
LF.13a.780.1,LF.13a,During deposition the materials are getting washed downstream and when the river comes to an opening they get deposited.,correct
LF.13a.784.1,LF.13a,During deposition earth materials get deposited into other places.,correct
LF.13a.819.1,LF.13a,The wearing down of earth material which will deposited.,incorrect
LF.13a.820.1,LF.13a,During deposition earth material settles to the bottom of a river.,correct
LF.13a.823.1,LF.13a,They are carried and stack upon each other and settle to the bottom.,incorrect
LF.13a.850.1,LF.13a,The earth materials is get carried off to the mouth of a river.,incorrect
LF.13a.914.1,LF.13a,During deposition earth materials are moved to a different place.,incorrect
LF.13a.918.1,LF.13a,What happens to earth material during deposition is that the materials are worn away from the earth.,incorrect
LF.13a.924.1,LF.13a,"During deposition earth material is deposited it formed deltas, a canyon, and a channel.",correct
LF.27a.391.1,LF.27a,"40, Because between each is 20 and if you times 20 twice you will get 40.",correct
LF.27a.393.1,LF.27a,"40, C is next to B so you add 20 meters to the elevation contour line band A.",correct
LF.27a.400.1,LF.27a,"40 meters, The contour interval is 20 meters.",correct
LF.27a.404.1,LF.27a,"225, You keep adding 75.",incorrect
LF.27a.405.1,LF.27a,Because it is the its spread apart.,incorrect
LF.27a.408.1,LF.27a,"60 meters, Because it said the change in elevation from line A to B is 20 meters so that lets me know to count by 20 meters.",incorrect
LF.27a.421.1,LF.27a,"40, Because it is 20 thought A to B and B to C.",correct
LF.27a.427.1,LF.27a,"283 meters, Because A is higher.",incorrect
LF.27a.436.1,LF.27a,"45, Because you can tell by the lines.",incorrect
LF.27a.437.1,LF.27a,25 meters.,incorrect
LF.27a.444.1,LF.27a,"30 meters, I measured with my fingers that C was half of B, and since B is 20 and half of that is 10 I added both of them together and got 30 meters.",incorrect
LF.27a.446.1,LF.27a,"360, big the line of the A, B, C, D.",incorrect
LF.27a.452.1,LF.27a,"C, Because it said the change in elevation for A and B was 20 meters and since it 20 they might be counting by 20's so that is my answer.",incorrect
LF.27a.462.1,LF.27a,"40, because if it is like then to get to C just add another 20 meters.",correct
LF.27a.468.1,LF.27a,"30, well because if A and B equals 20 meters and B true C looked like 10 more meters and I think is 30 meters.",incorrect
